{
  "$schema": "../schema/poc-manifest.schema.json",
  "name": "feature-grid-basic",
  "version": "0.1.0",
  "title": "Feature Grid Basic",
  "description": "A text-first Payload block for shipping a responsive feature grid with optional CTA wiring.",
  "registryItemName": "feature-grid-basic",
  "dependencies": {},
  "peerDependencies": {
    "next": "^15.0.0 || ^16.0.0",
    "payload": "^3.0.0"
  },
  "supportedTargets": ["payload-website-starter"],
  "supports": {
    "payloadMajors": [3],
    "nextMajors": [15, 16]
  },
  "files": [
    "src/blocks/FeatureGridBasic/config.ts",
    "src/blocks/FeatureGridBasic/Component.tsx"
  ],
  "payloadFragments": [
    {
      "kind": "renderBlocks",
      "importName": "FeatureGridBasicBlock",
      "importPath": "@/blocks/FeatureGridBasic/Component",
      "blockSlug": "featureGridBasic"
    },
    {
      "kind": "pagesLayout",
      "importName": "FeatureGridBasic",
      "importPath": "../../blocks/FeatureGridBasic/config",
      "blockName": "FeatureGridBasic"
    }
  ],
  "recovery": {
    "patchedFiles": [
      "src/blocks/RenderBlocks.tsx",
      "src/collections/Pages/index.ts"
    ]
  },
  "postInstall": ["generate:types", "generate:importmap"],
  "preview": {
    "summary": "Three-up feature grid with supporting copy and an optional CTA."
  },
  "sampleContent": {
    "blockType": "featureGridBasic",
    "eyebrow": "Payload Kits alpha",
    "title": "Add a feature grid that looks native to the repo on the first install.",
    "description": "This kit is designed to prove that multi-item content blocks install cleanly, register exactly once, and stay easy to reuse across client projects.",
    "items": [
      {
        "title": "Repo-aware install",
        "description": "Installs through the same registry flow as hero-basic and wires the block into the supported Payload layout surface."
      },
      {
        "title": "Text-first structure",
        "description": "Keeps the alpha block focused on clear editorial fields instead of extra primitives, icons, or interactive admin behavior."
      },
      {
        "title": "Multi-kit proof",
        "description": "Exercises the second-kit path so repeated installs, dedupe behavior, and state tracking are proven on real code."
      }
    ],
    "links": [
      {
        "link": {
          "type": "custom",
          "newTab": false,
          "url": "/admin",
          "label": "Review in Payload",
          "appearance": "default"
        }
      }
    ]
  }
}
