{
  "$schema": "../schema/poc-manifest.schema.json",
  "name": "integration-grid",
  "version": "0.1.1",
  "changelog": [
    {
      "version": "0.1.1",
      "summary": "Version the current component and shared source, including explicit localization semantics where applicable."
    },
    {
      "version": "0.1.0",
      "summary": "Initial release."
    }
  ],
  "title": "Integration Grid",
  "description": "A responsive grid of integration cards — logo, name, description, and a learn-more link — installed as a wired Payload block.",
  "registryItemName": "integration-grid",
  "dependencies": {},
  "peerDependencies": {
    "next": "^15.0.0 || ^16.0.0",
    "payload": "^3.0.0 || ^4.0.0-0"
  },
  "supportedTargets": ["payload-website-starter", "payload-blocks-app"],
  "supports": {
    "payloadMajors": [3, 4],
    "nextMajors": [15, 16]
  },
  "files": [
    "src/blocks/shared/integrationFields.ts",
    "src/blocks/IntegrationGrid/config.ts",
    "src/blocks/IntegrationGrid/Component.tsx"
  ],
  "payloadFragments": [
    {
      "kind": "renderBlocks",
      "importName": "IntegrationGridBlock",
      "importPath": "@/blocks/IntegrationGrid/Component",
      "blockSlug": "integrationGrid"
    },
    {
      "kind": "pagesLayout",
      "importName": "IntegrationGrid",
      "importPath": "../../blocks/IntegrationGrid/config",
      "blockName": "IntegrationGrid"
    }
  ],
  "recovery": {
    "patchedFiles": ["src/blocks/RenderBlocks.tsx", "src/collections/Pages/index.ts"]
  },
  "postInstall": ["generate:types", "generate:importmap"],
  "preview": {
    "summary": "Card grid of integrations, each with a logo, name, description, and learn-more link."
  },
  "sampleContent": {
    "blockType": "integrationGrid",
    "heading": "Connect to the tools you already run",
    "subtext": "Native integrations across analytics, billing, and messaging — wired in an afternoon.",
    "integrations": [
      { "name": "Northwind", "description": "Two-way sync that keeps usage and events flowing.", "href": "#" },
      { "name": "Globex", "description": "Pipe billing events straight into your workspace.", "href": "#" },
      { "name": "Initech", "description": "Stream product analytics with no glue code.", "href": "#" },
      { "name": "Vandelay", "description": "Route alerts to the channels your team lives in.", "href": "#" },
      { "name": "Soylent", "description": "Sync customer records both ways, automatically.", "href": "#" },
      { "name": "Umbra", "description": "Trigger workflows from any connected service.", "href": "#" }
    ]
  }
}
